{
  "title": "Swift Design launch email",
  "theme": {
    "name": "signal",
    "colors": {
      "background": "#f8fafc",
      "text": "#0f172a",
      "accent": "#0284c7",
      "muted": "#64748b"
    },
    "fonts": {
      "heading": "Inter",
      "body": "Inter",
      "mono": "JetBrains Mono"
    }
  },
  "format": "standard",
  "emails": [
    {
      "html": "<div class='e1-email'><p class='e1-brand'>Swift Design</p><h1>Six kinds. One chat.</h1><p class='e1-lead'>Demos, decks, documents, socials, prints, and now email, from one request.</p><a class='e1-cta' href='https://swift.design'>See it work</a><p class='e1-footer'>Swift Design · 1 Harness Way · Unsubscribe</p></div>",
      "css": ".e1-email { height: 100%; padding: 48px 40px; } .e1-brand { font-size: 14px; letter-spacing: 0.12em; text-transform: uppercase; color: var(--accent); margin-bottom: 24px; } h1 { font-size: 36px; font-weight: 800; line-height: 1.1; margin-bottom: 24px; } .e1-lead { font-size: 17px; line-height: 1.5; color: var(--muted); margin-bottom: 32px; } .e1-cta { display: inline-block; padding: 14px 28px; border-radius: 8px; background: var(--accent); color: var(--background); font-size: 16px; font-weight: 700; } .e1-footer { margin-top: 64px; font-size: 12px; color: var(--muted); }",
      "notes": "Subject: Six kinds, one chat. Preheader: Email joins the harness."
    },
    {
      "html": "<div class='e2-email'><p class='e2-brand'>Swift Design</p><h2>Ask, then send</h2><div class='columns'><div class='column'><h3>Describe it</h3><p class='e2-step'>Open a session and say what the email must do.</p></div><div class='column'><h3>Pick and send</h3><p class='e2-step'>Answer three short questions, pick a candidate, export the HTML.</p></div></div><a class='e2-cta' href='https://swift.design'>Try it now</a><p class='e2-footer'>Swift Design · 1 Harness Way · Unsubscribe</p></div>",
      "css": ".e2-email { height: 100%; padding: 48px 40px; } .e2-brand { font-size: 14px; letter-spacing: 0.12em; text-transform: uppercase; color: var(--accent); margin-bottom: 24px; } h2 { font-size: 30px; font-weight: 800; line-height: 1.15; margin-bottom: 24px; } .columns { width: 520px; margin-bottom: 32px; } .column { display: inline-block; vertical-align: top; width: 260px; padding-right: 20px; } h3 { font-size: 18px; font-weight: 700; margin-bottom: 8px; } .e2-step { font-size: 16px; line-height: 1.5; color: var(--muted); } .e2-cta { display: inline-block; padding: 14px 28px; border-radius: 8px; background: var(--accent); color: var(--background); font-size: 16px; font-weight: 700; } .e2-footer { margin-top: 64px; font-size: 12px; color: var(--muted); }",
      "notes": "Subject: Still writing emails by hand? Preheader: Three questions, one candidate."
    }
  ]
}
